{
  "name": "useMediaQuery",
  "description": "Custom hook that tracks the state of a media query using the [`Match Media API`](https://developer.mozilla.org/en-US/docs/Web/API/Window/matchMedia).",
  "props": [
    {
      "name": "query",
      "description": "The media query to track.",
      "type": "string",
      "required": true,
      "default": ""
    },
    {
      "name": "options",
      "description": "The options for customizing the behavior of the hook (optional).",
      "type": "UseMediaQueryOptions",
      "required": false,
      "default": "{}",
      "schema": [
        {
          "name": "defaultValue",
          "description": "The default value to return if the hook is being run on the server.",
          "type": "boolean",
          "rawType": "boolean",
          "required": false
        },
        {
          "name": "initializeWithValue",
          "description": "If `true` (default), the hook will initialize reading the media query. In SSR, you should set it to `false`, returning `options.defaultValue` or `false` initially.",
          "type": "boolean",
          "rawType": "boolean",
          "required": false
        }
      ]
    }
  ],
  "returns": [
    {
      "name": "return",
      "description": "Hook return value",
      "type": "boolean",
      "required": true
    }
  ]
}