{
  "name": "useAudioRecorder",
  "description": "A comprehensive hook for audio recording with real-time analysis using getUserMedia, MediaRecorder, and Web Audio APIs",
  "props": [
    {
      "name": "options",
      "description": "Configuration options for audio recording.",
      "type": "UseAudioRecorderOptions",
      "required": false,
      "default": "{}",
      "schema": [
        {
          "name": "audioBitsPerSecond",
          "description": "Audio bitrate in bits per second.",
          "type": "number",
          "rawType": "number",
          "required": false
        },
        {
          "name": "enableAnalysis",
          "description": "If set, enables real-time audio analysis during recording.",
          "type": "boolean",
          "rawType": "boolean",
          "required": false
        },
        {
          "name": "fftSize",
          "description": "FFT size for audio analysis.",
          "type": "number",
          "rawType": "number",
          "required": false
        },
        {
          "name": "mimeType",
          "description": "MIME type for the recorded audio.",
          "type": "AudioMimeType",
          "rawType": "\"audio/webm\" | \"audio/webm;codecs=opus\" | \"audio/webm;codecs=vorbis\" | \"audio/ogg\" | \"audio/ogg;codecs=opus\" | \"audio/ogg;codecs=vorbis\" | \"application/ogg\" | \"audio/mp4\" | \"audio/mp4;codecs=mp4a.40.2\" | \"audio/aac\" | \"audio/x-m4a\" | \"audio/mpeg\" | \"audio/mp3\" | \"audio/wav\" | \"audio/x-wav\" | \"audio/wave\" | \"audio/flac\" | \"audio/3gpp\" | \"audio/3gpp2\"",
          "required": false
        },
        {
          "name": "timeslice",
          "description": "Timeslice (ms) for MediaRecorder data chunks.",
          "type": "number",
          "rawType": "number",
          "required": false
        }
      ]
    }
  ],
  "returns": [
    {
      "name": "analysisData",
      "description": "Live audio analysis data.",
      "type": "AudioAnalysisData | null",
      "required": true
    },
    {
      "name": "audioBlob",
      "description": "Final recorded audio blob.",
      "type": "Blob | null",
      "required": true
    },
    {
      "name": "audioUrl",
      "description": "Object URL for the recorded audio.",
      "type": "string | null",
      "required": true
    },
    {
      "name": "clearRecording",
      "description": "Clears the current recording state.",
      "type": "() => void",
      "required": true
    },
    {
      "name": "downloadRecording",
      "description": "Downloads the recording as a file.",
      "type": "(filename: string) => void",
      "required": true
    },
    {
      "name": "duration",
      "description": "Duration of the recording in seconds.",
      "type": "number",
      "required": true
    },
    {
      "name": "error",
      "description": "Error message if recording fails.",
      "type": "string | null",
      "required": true
    },
    {
      "name": "isPaused",
      "description": "Whether recording is currently paused.",
      "type": "boolean",
      "required": true
    },
    {
      "name": "isRecording",
      "description": "Whether recording is currently active.",
      "type": "boolean",
      "required": true
    },
    {
      "name": "isSupported",
      "description": "Whether audio recording is supported in the current browser.",
      "type": "boolean",
      "required": true
    },
    {
      "name": "mediaRecorder",
      "description": "MediaRecorder instance.",
      "type": "MediaRecorder | null",
      "required": true
    },
    {
      "name": "pauseRecording",
      "description": "Pauses the recording.",
      "type": "() => void",
      "required": true
    },
    {
      "name": "resumeRecording",
      "description": "Resumes a paused recording.",
      "type": "() => void",
      "required": true
    },
    {
      "name": "startRecording",
      "description": "Starts audio recording.",
      "type": "() => Promise<void>",
      "required": true
    },
    {
      "name": "stopRecording",
      "description": "Stops audio recording.",
      "type": "() => void",
      "required": true
    },
    {
      "name": "stream",
      "description": "Active media stream.",
      "type": "MediaStream | null",
      "required": true
    }
  ],
  "types": [
    {
      "kind": "interface",
      "name": "AudioAnalysisData",
      "description": "Audio analysis data returned when `enableAnalysis` is true.",
      "properties": [
        {
          "name": "frequencyData",
          "description": "Frequency domain data (FFT).",
          "type": "Uint8Array",
          "rawType": "Uint8Array",
          "required": true
        },
        {
          "name": "timeData",
          "description": "Time domain waveform data.",
          "type": "Uint8Array",
          "rawType": "Uint8Array",
          "required": true
        },
        {
          "name": "volume",
          "description": "Calculated RMS volume level.",
          "type": "number",
          "rawType": "number",
          "required": true
        }
      ]
    }
  ]
}