{
  "name": "useFavicon",
  "description": "Custom hook that sets the document favicon.",
  "props": [
    {
      "name": "href",
      "description": "The URL of the favicon to set.",
      "type": "string",
      "required": true,
      "default": ""
    },
    {
      "name": "options",
      "description": "Configuration options.",
      "type": "UseFaviconOptions",
      "required": false,
      "default": "{}",
      "schema": [
        {
          "name": "preserveFaviconOnUnmount",
          "description": "Whether to keep the favicon after unmounting the component (default is `true`).\r If `false`, the favicon will revert to what it was before this hook mounted.",
          "type": "boolean",
          "rawType": "boolean",
          "required": false
        },
        {
          "name": "type",
          "description": "The MIME type of the favicon (default is `image/x-icon`).",
          "type": "string",
          "rawType": "string",
          "required": false
        }
      ]
    }
  ],
  "returns": [
    {
      "name": "return",
      "description": "Hook return value",
      "type": "void",
      "required": true
    }
  ],
  "types": []
}