{
  "name": "useSessionStorage",
  "description": "Custom hook that uses the [`sessionStorage API`](https://developer.mozilla.org/en-US/docs/Web/API/Window/sessionStorage) to persist state across page reloads.",
  "props": [
    {
      "name": "key",
      "description": "The key under which the value will be stored in session storage.",
      "type": "string",
      "required": true,
      "default": ""
    },
    {
      "name": "initialValue",
      "description": "The initial value of the state or a function that returns the initial value.",
      "type": "T | () => T",
      "required": true,
      "default": ""
    },
    {
      "name": "options",
      "description": "Options for customizing the behavior of serialization and deserialization (optional).",
      "type": "UseSessionStorageOptions<T>",
      "required": false,
      "default": "{}",
      "schema": [
        {
          "name": "deserializer",
          "description": "A function to deserialize the stored value.",
          "type": "(value: string) => T",
          "rawType": "(value: string) => T",
          "required": false
        },
        {
          "name": "initializeWithValue",
          "description": "If `true` (default), the hook will initialize reading the session storage. In SSR, you should set it to `false`, returning the initial value initially.",
          "type": "boolean",
          "rawType": "boolean",
          "required": false
        },
        {
          "name": "serializer",
          "description": "A function to serialize the value before storing it.",
          "type": "(value: T) => string",
          "rawType": "(value: T) => string",
          "required": false
        }
      ]
    }
  ],
  "returns": [
    {
      "name": "[0]",
      "description": "",
      "type": "T",
      "required": true
    },
    {
      "name": "[1]",
      "description": "",
      "type": "Dispatch<SetStateAction<T>>",
      "required": true
    },
    {
      "name": "[2]",
      "description": "",
      "type": "() => void",
      "required": true
    }
  ]
}