{
  "name": "useCopyToClipboard",
  "description": "Custom hook that copies text to the clipboard using the [`Clipboard API`](https://developer.mozilla.org/en-US/docs/Web/API/Clipboard_API).",
  "props": [],
  "returns": [
    {
      "name": "[0]",
      "description": "",
      "type": "CopiedValue",
      "rawType": "string | null",
      "required": true
    },
    {
      "name": "[1]",
      "description": "",
      "type": "CopyFn",
      "rawType": "(text: string) => Promise<boolean>",
      "required": true
    }
  ]
}