{
  "name": "useConferenceSystem",
  "description": "A comprehensive hook for managing video conferencing state, including camera access, screen sharing, network monitoring, and automatic media quality adjustment.",
  "props": [
    {
      "name": "options",
      "description": "Configuration options for the conference system.",
      "type": "UseConferenceSystemOptions",
      "required": false,
      "default": "{}",
      "schema": [
        {
          "name": "defaultAutoQuality",
          "description": "Whether to enable automatic network-based quality scaling on mount.",
          "type": "boolean",
          "rawType": "boolean",
          "required": false
        }
      ]
    }
  ],
  "returns": [
    {
      "name": "camera",
      "description": "Camera management and state",
      "type": "Object",
      "required": true,
      "schema": [
        {
          "name": "error",
          "description": "Error message if camera access or capture fails.",
          "type": "string | null",
          "rawType": "string | null",
          "required": true
        },
        {
          "name": "isActive",
          "description": "Whether the camera stream is currently active.",
          "type": "boolean",
          "rawType": "boolean",
          "required": true
        },
        {
          "name": "isLoading",
          "description": "Indicates if the camera is currently requesting permissions or initializing.",
          "type": "boolean",
          "rawType": "boolean",
          "required": true
        },
        {
          "name": "start",
          "description": "Starts the camera capture with optional constraints.",
          "type": "(constraints: UseUserMediaConstraints) => Promise<void>",
          "rawType": "(constraints: UseUserMediaConstraints) => Promise<void>",
          "required": true
        },
        {
          "name": "stop",
          "description": "Stops the camera capture and clears the stream.",
          "type": "() => void",
          "rawType": "() => void",
          "required": true
        },
        {
          "name": "stream",
          "description": "The active MediaStream for the camera, or null if inactive.",
          "type": "MediaStream | null",
          "rawType": "MediaStream | null",
          "required": true
        }
      ]
    },
    {
      "name": "network",
      "description": "Network status and telemetry",
      "type": "Object",
      "required": true,
      "schema": [
        {
          "name": "isOnline",
          "description": "Boolean indicating if the browser has an active internet connection.",
          "type": "boolean",
          "rawType": "boolean",
          "required": true
        },
        {
          "name": "speed",
          "description": "Estimated downlink speed in Mbps.",
          "type": "number",
          "rawType": "number",
          "required": true
        },
        {
          "name": "type",
          "description": "The network connection type (e.g., '4g', 'wifi', 'unknown').",
          "type": "string",
          "rawType": "string",
          "required": true
        }
      ]
    },
    {
      "name": "quality",
      "description": "Media quality management",
      "type": "Object",
      "required": true,
      "schema": [
        {
          "name": "current",
          "description": "The currently applied quality level ('low', 'medium', 'high').",
          "type": "MediaQuality",
          "rawType": "MediaQuality",
          "required": true
        },
        {
          "name": "isAuto",
          "description": "Whether automatic quality adjustment is currently enabled.",
          "type": "boolean",
          "rawType": "boolean",
          "required": true
        },
        {
          "name": "isChanging",
          "description": "Whether a quality transition is currently in progress.",
          "type": "boolean",
          "rawType": "boolean",
          "required": true
        },
        {
          "name": "set",
          "description": "Manually sets the media quality level (overrides auto-quality).",
          "type": "(level: MediaQuality) => Promise<void>",
          "rawType": "(level: MediaQuality) => Promise<void>",
          "required": true
        },
        {
          "name": "toggleAuto",
          "description": "Toggles the automatic quality scaling logic on or off.",
          "type": "() => void",
          "rawType": "() => void",
          "required": true
        }
      ]
    },
    {
      "name": "screen",
      "description": "Screen sharing management and state",
      "type": "Object",
      "required": true,
      "schema": [
        {
          "name": "error",
          "description": "Error message if screen share access fails or is denied.",
          "type": "string | null",
          "rawType": "string | null",
          "required": true
        },
        {
          "name": "isActive",
          "description": "Whether the screen share is currently active.",
          "type": "boolean",
          "rawType": "boolean",
          "required": true
        },
        {
          "name": "start",
          "description": "Starts the screen share capture process.",
          "type": "(options: UseScreenShareOptions) => Promise<void>",
          "rawType": "(options: UseScreenShareOptions) => Promise<void>",
          "required": true
        },
        {
          "name": "stop",
          "description": "Stops the screen share and clears the stream.",
          "type": "() => void",
          "rawType": "() => void",
          "required": true
        },
        {
          "name": "stream",
          "description": "The active MediaStream for screen sharing, or null if inactive.",
          "type": "MediaStream | null",
          "rawType": "MediaStream | null",
          "required": true
        }
      ]
    }
  ]
}