{
  "name": "useClickAway",
  "description": "Custom hook that triggers a callback when a user clicks outside the referenced element.\r It handles portal elements, scrollbar clicks, and touch interactions intelligently.",
  "props": [
    {
      "name": "onClickAway",
      "description": "The callback function to be called when a click outside is detected.",
      "type": "(event: MouseEvent | TouchEvent) => void",
      "required": true,
      "default": ""
    },
    {
      "name": "options",
      "description": "Configuration options for the hook.",
      "type": "UseClickAwayOptions",
      "required": true,
      "default": "{}",
      "schema": [
        {
          "name": "disableReactTree",
          "description": "If `true`, the React tree is ignored and only the DOM tree is considered.\r This prop changes how portaled elements are handled.",
          "type": "boolean",
          "rawType": "boolean",
          "required": false
        },
        {
          "name": "mouseEvent",
          "description": "The mouse event to listen to. You can disable the listener by providing `false`.",
          "type": "false | ClickAwayMouseEventHandler",
          "rawType": "false | \"onClick\" | \"onMouseDown\" | \"onMouseUp\" | \"onPointerDown\" | \"onPointerUp\"",
          "required": false
        },
        {
          "name": "ref",
          "description": "An external ref to merge with the hook's internal ref.\r Useful if you need to access the DOM element outside of this hook.",
          "type": "Ref<Element>",
          "rawType": "Ref<Element>",
          "required": false
        },
        {
          "name": "touchEvent",
          "description": "The touch event to listen to. You can disable the listener by providing `false`.",
          "type": "false | ClickAwayTouchEventHandler",
          "rawType": "false | \"onTouchStart\" | \"onTouchEnd\"",
          "required": false
        }
      ]
    }
  ],
  "returns": [
    {
      "name": "listenerProps",
      "description": "",
      "type": "Record<string, any>",
      "required": true
    },
    {
      "name": "ref",
      "description": "",
      "type": "Ref<Element>",
      "required": true
    }
  ],
  "types": [
    {
      "kind": "interface",
      "name": "UseClickAwayOptions",
      "description": "Options for the `useClickAway` hook.",
      "properties": [
        {
          "name": "disableReactTree",
          "description": "If `true`, the React tree is ignored and only the DOM tree is considered.\r This prop changes how portaled elements are handled.",
          "type": "boolean",
          "rawType": "boolean",
          "required": false
        },
        {
          "name": "mouseEvent",
          "description": "The mouse event to listen to. You can disable the listener by providing `false`.",
          "type": "false | ClickAwayMouseEventHandler",
          "rawType": "false | \"onClick\" | \"onMouseDown\" | \"onMouseUp\" | \"onPointerDown\" | \"onPointerUp\"",
          "required": false
        },
        {
          "name": "ref",
          "description": "An external ref to merge with the hook's internal ref.\r Useful if you need to access the DOM element outside of this hook.",
          "type": "Ref<Element>",
          "rawType": "Ref<Element>",
          "required": false
        },
        {
          "name": "touchEvent",
          "description": "The touch event to listen to. You can disable the listener by providing `false`.",
          "type": "false | ClickAwayTouchEventHandler",
          "rawType": "false | \"onTouchStart\" | \"onTouchEnd\"",
          "required": false
        }
      ]
    }
  ]
}